{
  "schema": "workflow_evolution.v1",
  "task_id": "task.phase16.workflow_evolution",
  "sprint_id": "sprint.autosci.phase16",
  "node_id": "node.workflow_evolve",
  "status": "completed",
  "inputs": {
    "trigger": "failed workflow run"
  },
  "outputs": {
    "evolution": {
      "proposal_id": "proposal.phase16.001",
      "scope": "scientific_research_lifecycle_full_v1",
      "change_type": "workflow_template",
      "rationale": "A failed experiment_run node exposed recoverable workflow, gate, manual, and schema gaps.",
      "expected_effect": "Improve retry diagnosis without applying changes automatically.",
      "approval_state": "proposed",
      "evidence_ids": [
        "experiment_run",
        "G_EXPERIMENT_RUN",
        "runtime.missing-result-log"
      ],
      "collected": {
        "failed_nodes": [
          {
            "node_id": "experiment_run",
            "logical_operator": "ScientificExperimentRunner",
            "status": "failed",
            "gate": "G_EXPERIMENT_RUN"
          }
        ],
        "gate_rejection_reasons": [
          {
            "gate_id": "G_EXPERIMENT_RUN",
            "status": "failed",
            "reasons": [
              "experiment_result.v1 missing logs artifact"
            ]
          }
        ],
        "ambiguous_manuals_or_prompts": [
          {
            "manual_id": "scientific-experiment-run.dispatch",
            "description": "Retry guidance did not distinguish rerun from redesign."
          }
        ],
        "insufficient_schemas": [
          {
            "schema": "experiment_result.v1",
            "description": "Log artifact requirement was not visible before gate time."
          }
        ],
        "poor_operator_bindings": [
          {
            "logical_operator": "ScientificExperimentRunner",
            "physical_operator": "autosci-experiment-worker",
            "description": "Binding lacked result-log preflight."
          }
        ],
        "human_intervention_points": [
          {
            "point": "experiment_retry_decision",
            "description": "Human should approve retry versus plan revision."
          }
        ],
        "runtime_errors": [
          {
            "error_id": "runtime.missing-result-log",
            "message": "Expected experiment_run.log was not written."
          }
        ]
      },
      "proposed_changes": [
        {
          "change_id": "change.manual.retry-guidance",
          "category": "manual",
          "target": "scientific-experiment-run.dispatch",
          "description": "Clarify retry guidance for fixture experiment failures.",
          "evidence_ids": [
            "experiment_run"
          ],
          "review_required": true,
          "application_state": "proposed_only"
        },
        {
          "change_id": "change.gate.result-log-diagnostics",
          "category": "gate",
          "target": "experiment_result_gate.py",
          "description": "Expose missing log artifact diagnostics before retry.",
          "evidence_ids": [
            "G_EXPERIMENT_RUN"
          ],
          "review_required": true,
          "application_state": "proposed_only"
        },
        {
          "change_id": "change.schema.result-log-field",
          "category": "schema",
          "target": "experiment_result.v1",
          "description": "Review whether log artifacts need a stronger schema contract.",
          "evidence_ids": [
            "runtime.missing-result-log"
          ],
          "review_required": true,
          "application_state": "proposed_only"
        }
      ],
      "review": {
        "human_accept_reject_required": true,
        "protected_core_edits_applied": false,
        "application_state": "proposed_only",
        "approval_ref": "N/A"
      },
      "recommended_changes_path": "artifacts/workflow_evolution/recommended_changes.md",
      "patch_candidates_path": "artifacts/workflow_evolution/patch_candidates"
    }
  },
  "artifacts": [
    {
      "type": "recommended_changes_markdown",
      "path": "artifacts/workflow_evolution/recommended_changes.md"
    },
    {
      "type": "patch_candidates_directory",
      "path": "artifacts/workflow_evolution/patch_candidates"
    }
  ],
  "provenance": {
    "operator_id": "ScientificWorkflowEvolver",
    "implementation_package": "plugins/autosci",
    "timestamp": "2026-06-18T21:30:00Z"
  },
  "limitations": [
    "Fixture proposal is not applied."
  ]
}
