{
  "schema": "workflow_evolution.v1",
  "task_id": "f",
  "sprint_id": "f",
  "node_id": "f",
  "status": "completed",
  "inputs": {},
  "outputs": {
    "evolution": {
      "proposal_id": "f",
      "scope": "f",
      "change_type": "memory_policy",
      "rationale": "f",
      "expected_effect": "f",
      "approval_state": "proposed",
      "evidence_ids": []
    }
  },
  "artifacts": [],
  "provenance": {
    "operator_id": "f",
    "implementation_package": "f",
    "timestamp": "2026-07-10T00:00:00Z"
  },
  "limitations": []
}
